{
  "schemaVersion": "2.0.0",
  "algorithm": "sha256",
  "contentHash": "sha256:e4def462b72a5040afebcb3a1143508f0d72776ad039be14eb28a0fc13bdb778",
  "toolVersion": "2.0.0",
  "evidenceSchemaVersion": "2.0.0",
  "argv": [
    "run",
    "--sign"
  ],
  "options": {
    "failOn": null,
    "failOnNewGaps": null,
    "base": null,
    "head": null,
    "out": null,
    "sarif": null,
    "spec": null,
    "baseline": null,
    "format": null,
    "sign": true
  },
  "exitCode": 0,
  "failOnOutcome": {
    "failed": false,
    "reason": "ok"
  },
  "checks": [
    {
      "id": "typecheck",
      "command": null,
      "exitCode": null,
      "status": "skipped"
    },
    {
      "id": "lint",
      "command": null,
      "exitCode": null,
      "status": "skipped"
    },
    {
      "id": "tests",
      "command": "/tmp/patchprove-legacy-observed-project-IFsmHb/node_modules/.bin/vitest run value.test.js --reporter=json --outputFile /tmp/patchprove-test-report-Y9ya4C/results.json",
      "exitCode": 0,
      "status": "passed"
    },
    {
      "id": "secrets",
      "command": null,
      "exitCode": 0,
      "status": "passed"
    }
  ],
  "generatedAt": "2026-10-23T09:38:20.032Z",
  "canonicalizationVersion": "2",
  "evidenceHash": "sha256:67ebde3d5be585f6d5802e0022fdb8c24100e9f007e324e6140b28243cdb6ad2",
  "executionHash": "sha256:abc8a5054e8fa604008567c7dd73c7c45ad3e0ef7accbb48f6438842442e85e5",
  "snapshotHash": "e0b1bc800869a6ce55ed2eb8c67f596f06d06583ab6a6043ea245bd333b8e348",
  "policyHash": "sha256:371d139629f53f2817ae90e409b59de1ddcab968818195c67f42f12bc850841f",
  "verification": {
    "status": "passed",
    "strict": true,
    "reasons": []
  },
  "effectivePolicy": {
    "protocol": 2,
    "strict": true,
    "failOn": null,
    "failOnNewGaps": null,
    "gates": {
      "typecheck": false,
      "lint": false,
      "tests": true,
      "secrets": true
    },
    "ignorePaths": [],
    "acceptGaps": [],
    "plugins": [],
    "config": null,
    "spec": null,
    "baseline": null,
    "hash": "sha256:371d139629f53f2817ae90e409b59de1ddcab968818195c67f42f12bc850841f"
  },
  "payloadHash": "sha256:991e862498ce8c5c7107cc4c9bf548ee8d7e5fecdbec19853604a30473f18787",
  "signature": {
    "alg": "hmac-sha256",
    "value": "MTXi9/l6Em/JAoPbgn28DyWs1fj/56Mr02N+Kppz4Ik="
  }
}
